{
  "schemaVersion": 1,
  "generatedAt": "2026-06-19T12:51:24.094Z",
  "model": {
    "id": "llamacpp-a374d516-fc11-4349-a7c7-d2b47a4a243f: gemma-4-26B-A4B-it-qat-heretic-GGUF",
    "label": "gemma-4-26B-A4B-it-qat-heretic",
    "slug": "gemma4-26b",
    "variant": "thinking"
  },
  "scoring": {
    "weights": {
      "toolcall": 0.3,
      "bugfind": 0.3,
      "hermes": 0.4
    },
    "maxScore": 91.8,
    "retryPenalty": 8,
    "effectiveScore": 83.8,
    "counts": {
      "pass": 42,
      "partial": 2,
      "fail": 6
    }
  },
  "suites": {
    "toolcall": {
      "packId": "toolcall-15",
      "packVersion": "1.0.1",
      "runId": "toolcall-15-2026-06-19T11-02-14.078Z-e10d3e9a",
      "startedAt": "2026-06-19T11:02:14.219Z",
      "completedAt": "2026-06-19T11:03:57.540Z",
      "model": {
        "id": "llamacpp-a374d516-fc11-4349-a7c7-d2b47a4a243f: gemma-4-26B-A4B-it-qat-heretic-GGUF",
        "label": "gemma-4-26B-A4B-it-qat-heretic"
      },
      "source": {
        "fileName": "summary.json",
        "sha256": "e18590f3500f3135fed7844320754372b7e3814288988846924853b6ba23708e"
      },
      "initialTotalScore": 93,
      "totalScore": 93,
      "categories": [
        {
          "id": "A",
          "label": "Tool Selection",
          "score": 100,
          "weight": 20
        },
        {
          "id": "B",
          "label": "Parameter Precision",
          "score": 100,
          "weight": 20
        },
        {
          "id": "C",
          "label": "Multi-Step Chains",
          "score": 67,
          "weight": 20
        },
        {
          "id": "D",
          "label": "Restraint & Refusal",
          "score": 100,
          "weight": 20
        },
        {
          "id": "E",
          "label": "Error Recovery",
          "score": 100,
          "weight": 20
        }
      ],
      "retryPenalty": 0,
      "counts": {
        "pass": 14,
        "partial": 0,
        "fail": 1
      },
      "results": [
        {
          "id": "TC-01",
          "status": "pass",
          "score": 100,
          "summary": "Used get_weather with Berlin only.",
          "attempts": 1,
          "retries": 0,
          "firstAttempt": {
            "status": "pass",
            "score": 100
          }
        },
        {
          "id": "TC-02",
          "status": "pass",
          "score": 100,
          "summary": "Used only get_stock_price for AAPL.",
          "attempts": 1,
          "retries": 0,
          "firstAttempt": {
            "status": "pass",
            "score": 100
          }
        },
        {
          "id": "TC-03",
          "status": "pass",
          "score": 100,
          "summary": "Looked up Sarah before sending the email.",
          "attempts": 1,
          "retries": 0,
          "firstAttempt": {
            "status": "pass",
            "score": 100
          }
        },
        {
          "id": "TC-04",
          "status": "pass",
          "score": 100,
          "summary": "Requested Tokyo weather in Fahrenheit explicitly.",
          "attempts": 1,
          "retries": 0,
          "firstAttempt": {
            "status": "pass",
            "score": 100
          }
        },
        {
          "id": "TC-05",
          "status": "pass",
          "score": 100,
          "summary": "Parsed next Monday and included the requested meeting details.",
          "attempts": 1,
          "retries": 0,
          "firstAttempt": {
            "status": "pass",
            "score": 100
          }
        },
        {
          "id": "TC-06",
          "status": "pass",
          "score": 100,
          "summary": "Issued separate translate_text calls for both languages.",
          "attempts": 1,
          "retries": 0,
          "firstAttempt": {
            "status": "pass",
            "score": 100
          }
        },
        {
          "id": "TC-07",
          "status": "pass",
          "score": 100,
          "summary": "Completed the full four-step chain with the right data.",
          "attempts": 1,
          "retries": 0,
          "firstAttempt": {
            "status": "pass",
            "score": 100
          }
        },
        {
          "id": "TC-08",
          "status": "fail",
          "score": 0,
          "summary": "Did not respect the weather-first conditional flow.",
          "attempts": 4,
          "retries": 0,
          "firstAttempt": {
            "status": "fail",
            "score": 0
          }
        },
        {
          "id": "TC-09",
          "status": "pass",
          "score": 100,
          "summary": "Handled both independent tasks.",
          "attempts": 1,
          "retries": 0,
          "firstAttempt": {
            "status": "pass",
            "score": 100
          }
        },
        {
          "id": "TC-10",
          "status": "pass",
          "score": 100,
          "summary": "Answered directly without tool use.",
          "attempts": 1,
          "retries": 0,
          "firstAttempt": {
            "status": "pass",
            "score": 100
          }
        },
        {
          "id": "TC-11",
          "status": "pass",
          "score": 100,
          "summary": "Did the math directly.",
          "attempts": 1,
          "retries": 0,
          "firstAttempt": {
            "status": "pass",
            "score": 100
          }
        },
        {
          "id": "TC-12",
          "status": "pass",
          "score": 100,
          "summary": "Refused cleanly because no delete-email tool exists.",
          "attempts": 1,
          "retries": 0,
          "firstAttempt": {
            "status": "pass",
            "score": 100
          }
        },
        {
          "id": "TC-13",
          "status": "pass",
          "score": 100,
          "summary": "Retried after the empty result and recovered.",
          "attempts": 1,
          "retries": 0,
          "firstAttempt": {
            "status": "pass",
            "score": 100
          }
        },
        {
          "id": "TC-14",
          "status": "pass",
          "score": 100,
          "summary": "Acknowledged the stock tool failure and handled it gracefully.",
          "attempts": 1,
          "retries": 0,
          "firstAttempt": {
            "status": "pass",
            "score": 100
          }
        },
        {
          "id": "TC-15",
          "status": "pass",
          "score": 100,
          "summary": "Used the searched population value in the calculator.",
          "attempts": 1,
          "retries": 0,
          "firstAttempt": {
            "status": "pass",
            "score": 100
          }
        }
      ]
    },
    "bugfind": {
      "packId": "bugfind-15",
      "packVersion": "1.0.1",
      "runId": "bugfind-15-2026-06-19T11-04-07.471Z-04ad8a94",
      "startedAt": "2026-06-19T11:04:08.189Z",
      "completedAt": "2026-06-19T11:40:34.707Z",
      "model": {
        "id": "llamacpp-a374d516-fc11-4349-a7c7-d2b47a4a243f: gemma-4-26B-A4B-it-qat-heretic-GGUF",
        "label": "gemma-4-26B-A4B-it-qat-heretic"
      },
      "source": {
        "fileName": "summary.json",
        "sha256": "dce6b57a3b08dd450f1c874e6dce768a4b27490c8da427199e80431406184107"
      },
      "initialTotalScore": 85,
      "totalScore": 97,
      "categories": [
        {
          "id": "A",
          "label": "Syntax & Surface",
          "score": 80,
          "weight": 15
        },
        {
          "id": "B",
          "label": "Logic & Algorithmic",
          "score": 100,
          "weight": 25
        },
        {
          "id": "C",
          "label": "Subtle & Tricky",
          "score": 100,
          "weight": 25
        },
        {
          "id": "D",
          "label": "Red Herring Resistance",
          "score": 100,
          "weight": 20
        },
        {
          "id": "E",
          "label": "Multi-Turn Debugging",
          "score": 100,
          "weight": 15
        }
      ],
      "retryPenalty": 3,
      "counts": {
        "pass": 14,
        "partial": 0,
        "fail": 1
      },
      "results": [
        {
          "id": "BF-01",
          "status": "pass",
          "score": 100,
          "summary": "Expected the model to isolate the off-by-one loop bounds bug.",
          "attempts": 1,
          "retries": 0,
          "firstAttempt": {
            "status": "pass",
            "score": 100
          }
        },
        {
          "id": "BF-02",
          "status": "pass",
          "score": 100,
          "summary": "Expected the model to identify the missing empty-string case.",
          "attempts": 1,
          "retries": 0,
          "firstAttempt": {
            "status": "pass",
            "score": 100
          }
        },
        {
          "id": "BF-03",
          "status": "fail",
          "score": 40,
          "summary": "Expected the model to recognize that the code is already correct.",
          "attempts": 3,
          "retries": 0,
          "firstAttempt": {
            "status": "fail",
            "score": 0
          }
        },
        {
          "id": "BF-04",
          "status": "pass",
          "score": 100,
          "summary": "Expected the model to diagnose and fix dictionary mutation during iteration.",
          "attempts": 1,
          "retries": 0,
          "firstAttempt": {
            "status": "pass",
            "score": 100
          }
        },
        {
          "id": "BF-05",
          "status": "pass",
          "score": 100,
          "summary": "Expected the model to diagnose loop-variable capture in Go 1.21.",
          "attempts": 2,
          "retries": 1,
          "firstAttempt": {
            "status": "partial",
            "score": 60
          }
        },
        {
          "id": "BF-06",
          "status": "pass",
          "score": 100,
          "summary": "Expected the model to add both missing awaits and fix the Promise mismatch.",
          "attempts": 1,
          "retries": 0,